{
  "name": "project-memory",
  "version": "0.1.0",
  "kind": "memory_scope",
  "description": "Allow access to validated, project-scoped procedural Agent Memory records that have passed runtime memory candidate validation and policy gates. This scope contains reusable process lessons only, not task-subject facts or source data.",
  "capability_class": "memory_access",
  "domain_tags": [
    "software-engineering",
    "runtime",
    "project-memory",
    "procedural-memory"
  ],
  "task_signals": {
    "task_types": [
      "code-review",
      "research",
      "task-execution"
    ],
    "risk_levels": [
      "low",
      "medium"
    ],
    "domains": [
      "software-engineering",
      "runtime"
    ],
    "required_inputs": [],
    "phrases": [
      "procedural lesson",
      "previous workflow decision",
      "project memory",
      "runtime reconstruction"
    ],
    "negative_phrases": [
      "customer record",
      "durable fact",
      "factual knowledge",
      "raw trace",
      "remember this customer",
      "source extract",
      "secret",
      "credentials",
      "task-subject fact"
    ]
  },
  "triggers": [
    "procedural lesson",
    "project memory",
    "previous workflow decision"
  ],
  "inputs": [],
  "outputs": [
    "procedural-memory-records"
  ],
  "required_tools": [],
  "optional_tools": [],
  "knowledge_scopes": [],
  "data_scopes": [],
  "policies": [
    "no-destructive-commands"
  ],
  "validators": [
    "review-findings-contract"
  ],
  "selection": {
    "base_score": 0.55,
    "score_modifiers": [
      {
        "signal": "phrase:project memory",
        "weight": 0.2,
        "reason": "Project memory is relevant when the task asks for prior procedural project lessons."
      },
      {
        "signal": "phrase:task-subject fact",
        "weight": -0.55,
        "reason": "Task-subject facts must use scoped Knowledge Records, not procedural Agent Memory."
      },
      {
        "signal": "phrase:customer record",
        "weight": -0.55,
        "reason": "Customer-specific factual content is not eligible for procedural Agent Memory."
      },
      {
        "signal": "phrase:secret",
        "weight": -0.5,
        "reason": "Secret-bearing content must not be loaded through project memory without a stronger policy gate."
      }
    ],
    "requires_all_policies": true
  },
  "tests": [
    "retrieves-approved-project-memory",
    "denies-raw-runtime-trace-memory",
    "denies-task-subject-fact-memory"
  ]
}
